[
  {
    "name": "Button",
    "description": "Primary button component for user interactions with Visa brand styling",
    "category": "form",
    "props": [
      {
        "name": "variant",
        "type": "string",
        "required": false,
        "default": "primary",
        "description": "Button style variant (primary, secondary, outline, ghost, destructive)"
      },
      {
        "name": "size",
        "type": "string",
        "required": false,
        "default": "medium",
        "description": "Button size (small, medium, large, xl)"
      },
      {
        "name": "disabled",
        "type": "boolean",
        "required": false,
        "default": false,
        "description": "Whether the button is disabled"
      },
      {
        "name": "loading",
        "type": "boolean",
        "required": false,
        "default": false,
        "description": "Whether the button is in loading state"
      },
      {
        "name": "fullWidth",
        "type": "boolean",
        "required": false,
        "default": false,
        "description": "Whether the button should take full width"
      },
      {
        "name": "icon",
        "type": "ReactNode",
        "required": false,
        "description": "Icon to display in the button"
      },
      {
        "name": "iconPosition",
        "type": "string",
        "required": false,
        "default": "left",
        "description": "Position of the icon (left, right)"
      },
      {
        "name": "onClick",
        "type": "function",
        "required": true,
        "description": "Click event handler"
      },
      {
        "name": "children",
        "type": "ReactNode",
        "required": true,
        "description": "Button content"
      }
    ],
    "variants": [
      {
        "name": "primary",
        "props": { "variant": "primary" },
        "description": "Primary action button with Visa blue background and white text"
      },
      {
        "name": "secondary",
        "props": { "variant": "secondary" },
        "description": "Secondary action button with light blue background"
      },
      {
        "name": "outline",
        "props": { "variant": "outline" },
        "description": "Outline button with Visa blue border for tertiary actions"
      },
      {
        "name": "ghost",
        "props": { "variant": "ghost" },
        "description": "Ghost button with no background for minimal actions"
      },
      {
        "name": "destructive",
        "props": { "variant": "destructive" },
        "description": "Destructive button with red styling for dangerous actions"
      }
    ],
    "examples": [
      {
        "title": "Primary Button",
        "description": "Standard primary button for main actions",
        "code": "<Button variant=\"primary\" onClick={handleSubmit}>Submit Payment</Button>",
        "language": "jsx"
      },
      {
        "title": "Button with Icon",
        "description": "Button with an icon for enhanced visual communication",
        "code": "<Button variant=\"primary\" icon={<CreditCardIcon />} onClick={handlePayment}>Pay Now</Button>",
        "language": "jsx"
      },
      {
        "title": "Loading Button",
        "description": "Button in loading state during async operations",
        "code": "<Button variant=\"primary\" loading={isLoading} onClick={handleSubmit}>Processing...</Button>",
        "language": "jsx"
      },
      {
        "title": "Full Width Button",
        "description": "Button that spans the full width of its container",
        "code": "<Button variant=\"primary\" fullWidth onClick={handleContinue}>Continue</Button>",
        "language": "jsx"
      }
    ],
    "guidelines": [
      "Use primary buttons for the main action on a page or section",
      "Limit to one primary button per view to maintain clear hierarchy",
      "Use secondary buttons for supporting actions that are still important",
      "Use outline buttons for tertiary actions or when multiple actions are needed",
      "Use ghost buttons for minimal actions that don't need emphasis",
      "Use destructive buttons only for irreversible actions like delete or cancel"
    ],
    "accessibility": {
      "ariaLabels": ["button", "submit", "cancel", "delete", "confirm"],
      "keyboardNavigation": "Tab to focus, Enter or Space to activate",
      "screenReaderSupport": "Announces button text, state (disabled/loading), and role",
      "colorContrast": "Meets WCAG AA standards (4.5:1 minimum) for all variants"
    }
  },
  {
    "name": "Card",
    "description": "Flexible container component for grouping related content with Visa styling",
    "category": "layout",
    "props": [
      {
        "name": "elevation",
        "type": "string",
        "required": false,
        "default": "md",
        "description": "Card elevation level (none, sm, md, lg, xl)"
      },
      {
        "name": "padding",
        "type": "string",
        "required": false,
        "default": "md",
        "description": "Internal padding (none, sm, md, lg, xl)"
      },
      {
        "name": "radius",
        "type": "string",
        "required": false,
        "default": "md",
        "description": "Border radius (none, sm, md, lg, xl, full)"
      },
      {
        "name": "clickable",
        "type": "boolean",
        "required": false,
        "default": false,
        "description": "Whether the card is clickable"
      },
      {
        "name": "variant",
        "type": "string",
        "required": false,
        "default": "default",
        "description": "Card variant (default, outlined, filled)"
      },
      {
        "name": "onClick",
        "type": "function",
        "required": false,
        "description": "Click event handler for clickable cards"
      },
      {
        "name": "children",
        "type": "ReactNode",
        "required": true,
        "description": "Card content"
      }
    ],
    "variants": [
      {
        "name": "default",
        "props": { "variant": "default", "elevation": "md" },
        "description": "Standard card with medium elevation and white background"
      },
      {
        "name": "outlined",
        "props": { "variant": "outlined", "elevation": "none" },
        "description": "Card with border outline and no shadow"
      },
      {
        "name": "filled",
        "props": { "variant": "filled", "elevation": "sm" },
        "description": "Card with light gray background fill"
      },
      {
        "name": "interactive",
        "props": { "clickable": true, "elevation": "md" },
        "description": "Interactive card that responds to hover and click"
      }
    ],
    "examples": [
      {
        "title": "Basic Card",
        "description": "Simple card container for content grouping",
        "code": "<Card><h3>Payment Summary</h3><p>Total: $125.00</p></Card>",
        "language": "jsx"
      },
      {
        "title": "Interactive Card",
        "description": "Clickable card for navigation or selection",
        "code": "<Card clickable onClick={handleCardSelect}><h3>Credit Card</h3><p>**** 1234</p></Card>",
        "language": "jsx"
      },
      {
        "title": "Outlined Card",
        "description": "Card with border styling for subtle emphasis",
        "code": "<Card variant=\"outlined\" padding=\"lg\"><h3>Account Details</h3></Card>",
        "language": "jsx"
      }
    ],
    "guidelines": [
      "Use cards to group related information and create visual hierarchy",
      "Maintain consistent spacing within cards using the padding prop",
      "Use elevation sparingly - higher elevation for more important content",
      "Make cards clickable only when they lead to another view or perform an action",
      "Use outlined variant when you need subtle separation without shadows"
    ],
    "accessibility": {
      "keyboardNavigation": "Tab to focus if clickable, Enter to activate",
      "screenReaderSupport": "Proper heading structure and content organization",
      "colorContrast": "Ensure sufficient contrast for all card content and borders"
    }
  },
  {
    "name": "Input",
    "description": "Form input component with Visa design system styling and validation",
    "category": "form",
    "props": [
      {
        "name": "type",
        "type": "string",
        "required": false,
        "default": "text",
        "description": "Input type (text, email, password, number, tel, url)"
      },
      {
        "name": "label",
        "type": "string",
        "required": false,
        "description": "Input label text"
      },
      {
        "name": "placeholder",
        "type": "string",
        "required": false,
        "description": "Placeholder text"
      },
      {
        "name": "value",
        "type": "string",
        "required": false,
        "description": "Input value"
      },
      {
        "name": "defaultValue",
        "type": "string",
        "required": false,
        "description": "Default input value"
      },
      {
        "name": "disabled",
        "type": "boolean",
        "required": false,
        "default": false,
        "description": "Whether the input is disabled"
      },
      {
        "name": "required",
        "type": "boolean",
        "required": false,
        "default": false,
        "description": "Whether the input is required"
      },
      {
        "name": "error",
        "type": "string",
        "required": false,
        "description": "Error message to display"
      },
      {
        "name": "helperText",
        "type": "string",
        "required": false,
        "description": "Helper text to display below input"
      },
      {
        "name": "size",
        "type": "string",
        "required": false,
        "default": "md",
        "description": "Input size (sm, md, lg)"
      },
      {
        "name": "icon",
        "type": "ReactNode",
        "required": false,